{
  "metadata_version": "1.0",
  "source_episode_id": "p03_e03",
  "feed_name": "Below the Surface",
  "feed_url": "http://localhost/",
  "episode_title": "Episode 3: Calm Under Pressure (with Owen Chen)",
  "published_at": "2025-09-17",
  "duration_seconds": 1950,
  "language": "en",
  "scraped_at": "2026-01-13T12:07:56.658830Z",
  "speakers": [
    {
      "id": "host",
      "name": "Rina",
      "role": "host"
    },
    {
      "id": "guest",
      "name": "Owen",
      "role": "guest"
    }
  ],
  "expectations": {
    "allow_speaker_names": false,
    "allow_speaker_labels": false,
    "allow_sponsor_content": false
  }
}